{
  "id": "todo-today",
  "kind": "panel",
  "type": "list",
  "title": "Today's tasks",
  "updatedAt": "2026-10-05T07:00:00Z",
  "priority": 3,
  "size": "M",
  "data": {
    "items": [
      {
        "id": "t-101",
        "text": "Send invoice to Acme",
        "subtitle": "Project Alpha",
        "due": "2026-10-05",
        "link": "https://ticktick.com/webapp/#p/abc123/tasks/t-101",
        "action": "complete",
        "ticktick": { "taskId": "t-101", "projectId": "abc123" }
      },
      {
        "id": "t-102",
        "text": "Book flights",
        "due": "2026-10-07T17:00:00Z",
        "links": [{ "text": "Airline", "link": "https://example.com/flights" }],
        "action": { "type": "complete" },
        "ticktick": { "taskId": "t-102", "projectId": "abc123" }
      },
      { "id": "t-099", "text": "Water plants", "checked": true, "checkedAt": "2026-10-05T06:40:00Z" }
    ],
    "emptyText": "Nothing due today"
  }
}
