{
  "id": "service-health",
  "kind": "panel",
  "type": "kpi",
  "title": "Service health",
  "updatedAt": "2026-10-05T07:50:00Z",
  "priority": 2,
  "size": "M",
  "staleAfter": "30m",
  "data": {
    "items": [
      { "label": "Uptime", "value": 99.95, "unit": "%", "state": "ok", "trend": { "delta": 0.02, "dir": "up", "good": "up" } },
      { "label": "p95 latency", "value": 412, "unit": "ms", "state": "warn", "trend": { "delta": 38, "dir": "up", "good": "down" } },
      { "label": "Failed jobs", "value": 3, "state": "fail", "link": "https://example.com/jobs?status=failed" },
      { "label": "Deploy", "value": "pending", "state": "pending" }
    ]
  }
}
