{
  "id": "daily-briefing",
  "kind": "panel",
  "type": "markdown",
  "title": "Daily briefing",
  "updatedAt": "2026-10-05T07:30:00Z",
  "priority": 3,
  "size": "M",
  "staleAfter": "26h",
  "data": {
    "text": "## Today\n\n- Standup at **10:00**\n- Review the open PRs\n- Renew the domain (expires Friday)\n\nSee the [runbook](https://example.com/runbook) for details."
  }
}
